{
  "schema_id": "geode.eval-catalog@1",
  "schema_version": 1,
  "entrypoint": "docs/eval/README.md",
  "skill": ".agents/skills/geode-eval/SKILL.md",
  "contracts": {
    "run_spec": "docs/eval/schemas/run-spec.schema.json",
    "attempt": "docs/eval/schemas/attempt.schema.json",
    "analysis": "docs/eval/schemas/analysis.schema.json",
    "publication": "docs/eval/schemas/publication.schema.json",
    "trajectory": "core/observability/schemas/trajectory.schema.json",
    "trajectory_release": "core/observability/schemas/trajectory-release.schema.json"
  },
  "document_count": 27,
  "documents": [
    {
      "id": "agent-world-comparison",
      "family": "agent-world-comparison",
      "title": "Agent-World Comparison Contract",
      "kind": "contract",
      "status": "canonical",
      "authority": "comparison-contract",
      "path": "docs/eval/agent-world-comparison-contract.md",
      "summary": "Canonical Agent-World v1 comparison profile for directional paper references and paired GEODE runtime controls.",
      "sha256": "e0f39f38b553b2ce7c2c430f769ed02f15e5c29d53692c195d4ef6be3456f877",
      "triggers": [
        "Agent-World",
        "BFCL V4",
        "MCP-Mark",
        "mean_accuracy@8",
        "paired runtime",
        "tau2"
      ],
      "contracts": [
        "docs/eval/agent-world-run-manifest.template.json",
        "docs/eval/schemas/run-spec.schema.json"
      ]
    },
    {
      "id": "benchmark-publishing-cycle",
      "family": "benchmark-publishing",
      "title": "Benchmark Publishing Cycle",
      "kind": "workflow",
      "status": "canonical",
      "authority": "process",
      "path": "docs/eval/benchmark-publishing-cycle.md",
      "summary": "End-to-end workflow from preregistered benchmark scope through evidence preservation, publication, and deployment.",
      "sha256": "b61114e8d4b0b9fad244c7e324fb047ab697c91a7f14069d5f5a2c5a6a5139be",
      "triggers": [
        "attempts JSONL",
        "benchmark run",
        "eval artifact",
        "publish evaluation",
        "run spec"
      ],
      "contracts": [
        "docs/eval/artifact-publish-manifest.template.json",
        "docs/eval/eval-analysis.template.json",
        "docs/eval/eval-attempt.template.json",
        "docs/eval/eval-run-spec.template.json",
        "docs/eval/schemas/analysis.schema.json",
        "docs/eval/schemas/attempt.schema.json",
        "docs/eval/schemas/publication.schema.json",
        "docs/eval/schemas/run-spec.schema.json"
      ]
    },
    {
      "id": "benchmark-run-record",
      "family": "benchmark-run-record",
      "title": "Benchmark Run Record Template",
      "kind": "template",
      "status": "canonical",
      "authority": "human-run-report",
      "path": "docs/eval/benchmark-run-record.template.md",
      "summary": "Human-readable benchmark report template derived from frozen run, attempt, analysis, and evidence sidecars.",
      "sha256": "2e7622d411b1eeb19033c08270dfefe8c068a5845f24869c7c2ea517bcfcd937",
      "triggers": [
        "benchmark report",
        "result publication",
        "run record"
      ],
      "contracts": [
        "docs/eval/schemas/analysis.schema.json",
        "docs/eval/schemas/attempt.schema.json",
        "docs/eval/schemas/run-spec.schema.json"
      ]
    },
    {
      "id": "eval-data-model",
      "family": "eval-data-model",
      "title": "Evaluation data model",
      "kind": "contract",
      "status": "canonical",
      "authority": "derived-view-contract",
      "path": "docs/eval/data-model.md",
      "summary": "Versioned joins for examples, rollouts, immutable trajectories, and evaluator-owned rewards, with supplementary usage and cache-accounting evidence.",
      "sha256": "aba06865f922c5e25af2929e02e72314239757ae6f87f0586bf88762f81d7768",
      "triggers": [
        "cache accounting",
        "evaluation data model",
        "example rollout trajectory reward",
        "learning data",
        "usage and cost evidence"
      ],
      "contracts": [
        "core/observability/schemas/trajectory.schema.json",
        "docs/eval/schemas/example.schema.json",
        "docs/eval/schemas/learning-view-manifest.schema.json",
        "docs/eval/schemas/reward.schema.json",
        "docs/eval/schemas/rollout.schema.json"
      ]
    },
    {
      "id": "evaluation-index",
      "family": "evaluation-routing",
      "title": "GEODE Evaluation Index and Roadmap",
      "kind": "index",
      "status": "canonical",
      "authority": "routing",
      "path": "docs/eval/README.md",
      "summary": "Machine and human entrypoint for GEODE evaluation contracts, benchmark ledgers, evidence, and publication.",
      "sha256": "bb74f97a3a7610545e34dd9c49829ae7da57f29d74b9ad31598f9af7b500e2d6",
      "triggers": [
        "artifact",
        "benchmark",
        "evaluation",
        "research question",
        "trajectory"
      ],
      "contracts": [
        "docs/eval/artifact-publish-manifest.template.json",
        "docs/eval/eval-analysis.template.json",
        "docs/eval/eval-attempt.template.json",
        "docs/eval/eval-run-spec.template.json",
        "docs/eval/schemas/analysis.schema.json",
        "docs/eval/schemas/attempt.schema.json",
        "docs/eval/schemas/publication.schema.json",
        "docs/eval/schemas/run-spec.schema.json"
      ],
      "latest_valid_release": "https://github.com/mangowhoiscloud/geode-eval-artifacts/tree/1efee3d0f4bfda3464b23b298a36f9a97f5fa691/skill-attribution/results-paired/skill-attribution-sol-max-paired-r3-20260826t130119z/trajectory-release/skill-attribution-skill-attribution-sol-max-paired-r3-20260826t130119z-20260826T133729Z-f6ee84d7139a"
    },
    {
      "id": "external-artifact-repository",
      "family": "evaluation-artifact-storage",
      "title": "External Evaluation Artifact Repository",
      "kind": "contract",
      "status": "canonical",
      "authority": "evidence-storage",
      "path": "docs/eval/external-artifact-repository.md",
      "summary": "Canonical append-only publication and disclosure contract for large GEODE evaluation artifacts.",
      "sha256": "d1e98122dcab3cbc24646c6abb9a13c15f0600e7322442d79d04e3140a24fc3a",
      "triggers": [
        "artifact repository",
        "eval-artifact",
        "privacy review",
        "publication manifest",
        "trajectory release"
      ],
      "contracts": [
        "core/observability/schemas/trajectory-release.schema.json",
        "core/observability/schemas/trajectory.schema.json",
        "docs/eval/artifact-publish-manifest.template.json",
        "docs/eval/schemas/analysis.schema.json",
        "docs/eval/schemas/attempt.schema.json",
        "docs/eval/schemas/publication.schema.json",
        "docs/eval/schemas/run-spec.schema.json"
      ]
    },
    {
      "id": "frontier-agentic-tool-use-cases",
      "family": "frontier-agentic-tool-use-cases",
      "title": "Frontier Agentic Tool-Use Benchmark Cases",
      "kind": "ledger",
      "status": "reference",
      "authority": "dated-evidence-ledger",
      "path": "docs/eval/frontier-agentic-tool-use-benchmark-cases.md",
      "summary": "Dated evidence ledger for public MCPMark, BFCL V4, and tau2 tool-use cases and GEODE comparisons.",
      "sha256": "576f89520db449211854d3517face318787604b873224aeecb2e303df59140c9",
      "triggers": [
        "BFCL cases",
        "MCPMark cases",
        "frontier tool use",
        "tau2 cases"
      ],
      "contracts": [
        "docs/eval/agent-world-comparison-contract.md"
      ]
    },
    {
      "id": "geo-visibility",
      "family": "geo-visibility",
      "title": "GEO Visibility Benchmark",
      "kind": "benchmark",
      "status": "canonical",
      "authority": "suite-profile",
      "path": "docs/eval/geo-visibility.md",
      "summary": "Reproducible GEODE profile for measuring generative discovery, citation selection, answer absorption, and fidelity without collapsing them into one GEO score.",
      "sha256": "e6398f240cb477c8c0ab112b2291b1f2f9039ac0e4b31ceace1b371eeafc74c7",
      "triggers": [
        "AI search visibility",
        "GEO",
        "citation benchmark",
        "generative engine optimization",
        "query fan-out"
      ],
      "contracts": [
        "core/observability/schemas/trajectory-release.schema.json",
        "core/observability/schemas/trajectory.schema.json",
        "docs/eval/artifact-publish-manifest.template.json",
        "docs/eval/schemas/geo-claim-universe.schema.json",
        "docs/eval/schemas/geo-host-preflight-v2.schema.json",
        "docs/eval/schemas/geo-host-preflight.schema.json",
        "docs/eval/schemas/geo-human-calibration.schema.json",
        "docs/eval/schemas/geo-link-audit.schema.json",
        "docs/eval/schemas/geo-live-approval.schema.json",
        "docs/eval/schemas/geo-native-results.schema.json",
        "docs/eval/schemas/geo-outcome.schema.json",
        "docs/eval/schemas/geo-preflight.schema.json",
        "docs/eval/schemas/geo-source-receipt-v2.schema.json",
        "docs/eval/schemas/geo-source-receipt.schema.json",
        "docs/eval/schemas/geo-vector.schema.json",
        "docs/eval/schemas/geo-verifier-receipt-v2.schema.json",
        "docs/eval/schemas/geo-verifier-receipt.schema.json",
        "docs/eval/schemas/geo-verifier-results-v2.schema.json",
        "docs/eval/schemas/geo-verifier-results.schema.json",
        "docs/eval/schemas/geo-workload.schema.json",
        "docs/eval/schemas/publication.schema.json",
        "docs/eval/schemas/run-spec.schema.json"
      ]
    },
    {
      "id": "hal-reliability",
      "family": "hal-reliability",
      "title": "HAL Reliability (Princeton, ICLR 2026)",
      "kind": "benchmark",
      "status": "canonical",
      "authority": "external-benchmark-profile",
      "path": "docs/eval/hal-reliability.md",
      "summary": "GEODE adoption profile for HAL consistency, robustness, safety, predictability, and self-awareness measurements.",